{
  "schemaVersion": "2026-06-05.research.deep-research-worker-lifecycle-recorded.v1",
  "runtimeId": "research_deep_research_worker_lifecycle_runtime",
  "commandPort": "DeepResearchWorkerCommandPort.recordDeepResearchWorkerLifecycle",
  "status": "CLAIMED_FOR_ASYNC_EXECUTION",
  "recordId": "research_deep_research_worker_deep-research-worker-lifecycle_job-001_claim",
  "recordedAt": "2026-06-05T00:00:00.000Z",
  "idempotencyKey": "deep-research-worker-lifecycle:job-001:claim",
  "idempotentReplay": false,
  "job": {
    "taskId": "agent_task_research_deep_001",
    "contextRef": "shared_ctx_research_deep_001",
    "jobId": "deep_research_job_001",
    "queueName": "research_deep_research"
  },
  "approval": {
    "approvalId": "deep_research_approval_001",
    "approvalRecordRef": "evidence:human-approval:deep-research-job-001",
    "reviewerPrincipalId": "teacher_001",
    "decision": "APPROVED_FOR_ASYNC"
  },
  "worker": {
    "workerId": "local_research_worker_001",
    "nodeType": "LOCAL",
    "capabilityKinds": ["RAG_RETRIEVAL", "MODEL_REASONING"],
    "leaseDurationMs": 30000,
    "maxConcurrentJobs": 4
  },
  "lifecycle": {
    "action": "CLAIM",
    "fromStatus": "APPROVED_FOR_ASYNC",
    "toStatus": "CLAIMED",
    "leaseExpiresAt": "2026-06-05T00:00:30.000Z"
  },
  "failure": null,
  "evidenceRefs": [
    "evidence:deep-research-intent:job-001",
    "evidence:human-approval:deep-research-job-001",
    "evidence:approval:deep_research_approval_001",
    "evidence:input-hash:sha256:example",
    "evidence:runtime:research_deep_research_worker_lifecycle_runtime",
    "evidence:command-port:DeepResearchWorkerCommandPort.recordDeepResearchWorkerLifecycle"
  ],
  "boundary": {
    "approvalVerified": true,
    "workerClaimRecorded": true,
    "failedSafeRecorded": false,
    "executionStarted": false,
    "ragRetrievalStarted": false,
    "externalModelCallStarted": false,
    "finalAnswerGenerated": false,
    "directPublicationAllowed": false,
    "localToolMutationAllowed": false,
    "directMainDatabaseWriteAllowed": false,
    "studentArchiveUsed": false,
    "remoteDeviceSourcesUsed": false,
    "swarmAllowed": false,
    "requiresFutureExecutionSlice": true
  },
  "runtimeSlo": {
    "targetP99Ms": 50,
    "evidenceClass": "ASYNC_DEEP_RESEARCH_WORKER_LIFECYCLE_CONTROL_PLANE"
  },
  "nextAction": "Use this claim as worker-side lifecycle evidence; retrieval, model reasoning, synthesis, and final answer remain future approved async slices."
}
